{
  "schemaVersion": 1,
  "institution": "guelph",
  "sources": [
    {
      "id": "guelph-official-map-2025",
      "title": "University of Guelph Campus Map",
      "url": "https://www.uoguelph.ca/maps/",
      "retrievedAt": "2026-09-26",
      "licenseOrTerms": "Published factual building names and codes; map artwork is not copied",
      "redistribution": "permitted",
      "transformation": "Cross-checked individual factual building names, codes, and locations",
      "attribution": "University of Guelph"
    }
  ],
  "terms": [],
  "courses": []
}
