{
  "schemaVersion": 1,
  "institution": "uottawa",
  "sources": [
    {
      "id": "uottawa-official-map-2025",
      "title": "University of Ottawa Campus Map",
      "url": "https://www.uottawa.ca/about-us/maps",
      "retrievedAt": "2026-09-26",
      "licenseOrTerms": "Published factual building names and codes; map artwork is not copied",
      "redistribution": "permitted",
      "transformation": "Cross-checked individual factual building names, codes, and locations",
      "attribution": "University of Ottawa"
    }
  ],
  "terms": [],
  "courses": []
}
