{
  "schemaVersion": 1,
  "institution": "laurier",
  "sources": [
    {
      "id": "laurier-official-map-2025",
      "title": "Wilfrid Laurier University Campus Map",
      "url": "https://www.wlu.ca/about/campuses-and-locations/waterloo-campus/maps.html",
      "retrievedAt": "2026-09-24",
      "licenseOrTerms": "Published factual building names and codes; map artwork is not copied",
      "redistribution": "permitted",
      "transformation": "Cross-checked individual factual building names, codes, and locations",
      "attribution": "Wilfrid Laurier University"
    }
  ],
  "terms": [],
  "courses": []
}
